{
  "$schema": "https://json-schema.org/draft/2020-12/schema",
  "$id": "https://beaconlab.dev/schemas/evidence-0.5.json",
  "title": "Project Beacon Evidence",
  "type": "object",
  "required": [
    "evidence_version",
    "run_id",
    "scenario",
    "subject",
    "result",
    "assertions",
    "state",
    "state_diff",
    "events",
    "artifacts",
    "reset_verified",
    "limitations",
    "digest",
    "usage"
  ],
  "properties": {
    "evidence_version": {
      "const": "0.5"
    },
    "run_id": {
      "type": "string"
    },
    "started_at": {
      "type": "string",
      "format": "date-time"
    },
    "completed_at": {
      "type": "string",
      "format": "date-time"
    },
    "scenario": {
      "type": "object"
    },
    "subject": {
      "type": "object"
    },
    "result": {
      "enum": [
        "PASS",
        "FAIL",
        "INCOMPLETE"
      ]
    },
    "assertions": {
      "type": "array"
    },
    "state": {
      "type": "object"
    },
    "state_diff": {
      "type": "object"
    },
    "events": {
      "type": "array"
    },
    "artifacts": {
      "type": "object"
    },
    "reset_verified": {
      "type": "boolean"
    },
    "limitations": {
      "type": "array",
      "items": {
        "type": "string"
      }
    },
    "digest": {
      "type": "string",
      "pattern": "^[a-f0-9]{64}$"
    },
    "usage": {
      "description": "What the run cost on the subject's side: request counts and wall time. Token spend inside a remote agent is not visible to Beacon.",
      "type": "object"
    },
    "repeat": {
      "type": "array",
      "description": "Later passes of the same subject on the same input, for a scenario that declared repeat. Empty otherwise.",
      "items": {
        "type": "object",
        "required": [
          "pass",
          "artifacts",
          "after",
          "subject"
        ],
        "properties": {
          "pass": {
            "type": "integer",
            "minimum": 2
          },
          "artifacts": {
            "type": "object"
          },
          "after": {
            "type": "object"
          },
          "subject": {
            "type": "object"
          }
        }
      }
    }
  },
  "additionalProperties": false
}
